{
  "schemaVersion": "v0.1",
  "generatedAt": "2026-05-22T14:08:33Z",
  "tool": {
    "name": "honua-esri-assess",
    "version": "0.1.0"
  },
  "source": {
    "kind": "arcgis-online",
    "locator": "example.maps.arcgis.com/0123ABCDEF456789",
    "capturedAt": "2026-05-22T14:02:11Z"
  },
  "portal": {
    "orgId": "0123ABCDEF456789",
    "orgUrl": "https://example.maps.arcgis.com",
    "itemCounts": {
      "Feature Service": 2,
      "Survey123 Form": 1,
      "Web Map": 1
    },
    "sharingSummary": {
      "private": 2,
      "org": 1,
      "public": 1,
      "shared": 0
    }
  },
  "inventory": [
    {
      "kind": "portal-item",
      "id": "a1b2c3d4e5f60718293a4b5c6d7e8f90",
      "type": "Feature Service",
      "owner": "gis.admin",
      "title": "Parcels",
      "sharing": "org",
      "modified": "2026-04-18T09:12:00Z",
      "extent": {
        "bbox": [-122.52, 47.43, -122.18, 47.74],
        "crs": { "wkid": 4326 }
      },
      "dependencies": []
    },
    {
      "kind": "portal-item",
      "id": "b2c3d4e5f6071829a3b4c5d6e7f80910",
      "type": "Feature Service",
      "owner": "field.crew",
      "title": "Hydrants",
      "sharing": "private",
      "modified": "2026-05-01T16:40:22Z",
      "extent": {
        "bbox": [-122.49, 47.45, -122.22, 47.71],
        "crs": { "wkid": 4326 }
      }
    },
    {
      "kind": "portal-item",
      "id": "c3d4e5f60718293a4b5c6d7e8f901122",
      "type": "Web Map",
      "owner": "gis.admin",
      "title": "Public Asset Viewer",
      "sharing": "public",
      "modified": "2026-05-10T11:00:00Z",
      "dependencies": [
        "a1b2c3d4e5f60718293a4b5c6d7e8f90",
        "b2c3d4e5f6071829a3b4c5d6e7f80910"
      ]
    },
    {
      "kind": "portal-item",
      "id": "d4e5f60718293a4b5c6d7e8f90112233",
      "type": "Survey123 Form",
      "owner": "field.crew",
      "title": "Field Damage Survey",
      "sharing": "private",
      "modified": "2026-05-12T18:30:00Z",
      "dependencies": [
        "b2c3d4e5f6071829a3b4c5d6e7f80910"
      ]
    }
  ],
  "counts": {
    "items": {
      "portal-item": 4,
      "server-service": 0,
      "filegdb-feature-class": 0
    },
    "layers": 0,
    "featureClasses": 0
  },
  "diagnostics": [
    {
      "code": "missing-permission",
      "severity": "warn",
      "message": "Skipped 2 items the scanner credential cannot read.",
      "scope": "arcgis-online",
      "hint": "Re-run with a credential that has read access to the GIS Admin group."
    },
    {
      "code": "unresolved-reference",
      "severity": "warn",
      "message": "Web map references one item that was not included in the scan result.",
      "scope": "c3d4e5f60718293a4b5c6d7e8f901122",
      "hint": "Confirm the referenced item exists and is readable before migration."
    },
    {
      "code": "rate-limited",
      "severity": "info",
      "message": "Sharing API throttled the scan for 3.2s.",
      "scope": "arcgis-online"
    }
  ]
}
